{
  "planId": "plan_auto_up_001",
  "planVersion": 1,
  "instruction": "将 AutoUp 临时笔记移动到项目目录并补充项目标签。",
  "summary": "移动一篇笔记并添加 AutoUp 标签。",
  "source": {
    "actorType": "agent",
    "actorId": "agent_local_001",
    "channel": "obsidian",
    "remote": false,
    "instructionId": "instruction_001"
  },
  "riskLevel": "medium",
  "status": "pending-confirmation",
  "requiresConfirmation": true,
  "confirmationPolicy": {
    "mode": "explicit",
    "approverTypes": [
      "local-user"
    ],
    "expiresAt": "2026-07-10T16:00:00+08:00"
  },
  "createdAt": "2026-07-10T15:40:00+08:00",
  "expiresAt": "2026-07-10T16:00:00+08:00",
  "operations": [
    {
      "operationId": "operation_move_001",
      "type": "move-note",
      "order": 0,
      "description": "将临时笔记移动到 AutoUp 项目目录。",
      "reason": "笔记内容与 AutoUp 项目直接相关。",
      "riskLevel": "medium",
      "dependsOn": [],
      "preconditions": [
        {
          "type": "file-exists",
          "target": "Inbox/发布失败重试.md",
          "failureCode": "NOTE_NOT_FOUND"
        },
        {
          "type": "version-match",
          "target": "Inbox/发布失败重试.md",
          "expected": "0000000000000000000000000000000000000000000000000000000000000000",
          "failureCode": "NOTE_VERSION_CONFLICT"
        }
      ],
      "expectedResult": {
        "affectedPaths": [
          "Projects/AutoUp/发布失败重试.md"
        ]
      },
      "idempotencyKey": "move-note:auto-up:001",
      "input": {
        "sourcePath": "Inbox/发布失败重试.md",
        "targetPath": "Projects/AutoUp/发布失败重试.md",
        "expectedVersionHash": "0000000000000000000000000000000000000000000000000000000000000000",
        "updateLinks": true,
        "conflictPolicy": "fail"
      }
    },
    {
      "operationId": "operation_metadata_001",
      "type": "update-metadata",
      "order": 1,
      "description": "补充 AutoUp 项目标签。",
      "reason": "保持项目笔记标签规范一致。",
      "riskLevel": "low",
      "dependsOn": [
        "operation_move_001"
      ],
      "preconditions": [
        {
          "type": "file-exists",
          "target": "Projects/AutoUp/发布失败重试.md",
          "failureCode": "NOTE_NOT_FOUND"
        }
      ],
      "idempotencyKey": "update-metadata:auto-up:001",
      "input": {
        "path": "Projects/AutoUp/发布失败重试.md",
        "expectedMetadataHash": "1111111111111111111111111111111111111111111111111111111111111111",
        "addTags": [
          "AutoUp",
          "浏览器插件"
        ]
      }
    }
  ],
  "affectedResources": [
    {
      "resourceType": "note",
      "path": "Inbox/发布失败重试.md",
      "action": "move"
    },
    {
      "resourceType": "note",
      "path": "Projects/AutoUp/发布失败重试.md",
      "action": "update"
    }
  ],
  "warnings": [],
  "rollbackPolicy": {
    "mode": "required",
    "snapshotRequired": true,
    "retentionSeconds": 604800,
    "maxRollbackAgeSeconds": 604800
  },
  "failurePolicy": "rollback-all",
  "idempotencyKey": "operation-plan:auto-up:001",
  "integrity": {
    "algorithm": "sha256",
    "value": "0000000000000000000000000000000000000000000000000000000000000000"
  }
}
